{
  "schemaVersion": "finance-agent-solution-build.v1",
  "solutionId": "wealth-customer-diagnosis-demo",
  "displayName": "客户财富体检助手",
  "runtime": {
    "family": "openjiuwen",
    "language": "java",
    "templateRef": "git+https://github.com/wuxiaojingjing/mobile-banking-3.0.git@f89c9fb2215dc4ebca169f676f96fac2d18b0e8c#agents/domain-runtime",
    "integrationRef": "repo://integrations/openjiuwen-java"
  },
  "profileRef": {
    "id": "customer-self-service",
    "version": "0.1.0",
    "source": "repo://profiles"
  },
  "domainPackRefs": [
    {
      "id": "wealth-customer-self-service",
      "version": "0.1.0",
      "source": "repo://domain-packs/wealth/customer-self-service"
    }
  ],
  "providerRefs": [
    {
      "id": "non-ai-banking-reference",
      "version": "0.1.0-SNAPSHOT",
      "source": "repo://providers/non-ai-banking"
    }
  ],
  "modelRef": "env://FINANCE_AGENT_MODEL",
  "evaluationPackRef": {
    "id": "wealth-management",
    "version": "0.2.3",
    "source": "git+https://github.com/bitlhk/finance-skill-eval.git@e960d2e#packs/finance/wealth-management"
  }
}
